{
  "version": "1.0",
  "generated_on": "2025-10-05T00:00:00+09:00",
  "engine_name_ko": "육십갑자 테이블",
  "source_refs": ["三命通會", "協紀辨方書", "Modern Saju Practice"],
  "disclaimer": "본 테이블은 전통 60갑자 순환 및 납음 오행 체계를 표준화한 데이터 정책입니다.",
  "fields": ["index","stem","branch","stem_index","branch_index","element","polarity","nayin","nayin_element","label_ko","label_zh","label_en"],
  "records": [
    {"index":1,"stem":"甲","branch":"子","stem_index":1,"branch_index":1,"element":"木","polarity":"陽","nayin":"海中金","nayin_element":"金","label_ko":"갑자(해중금)","label_zh":"甲子(海中金)","label_en":"Jia-Zi (Metal in the Sea)"},
    {"index":2,"stem":"乙","branch":"丑","stem_index":2,"branch_index":2,"element":"木","polarity":"陰","nayin":"海中金","nayin_element":"金","label_ko":"을축(해중금)","label_zh":"乙丑(海中金)","label_en":"Yi-Chou (Metal in the Sea)"},
    {"index":3,"stem":"丙","branch":"寅","stem_index":3,"branch_index":3,"element":"火","polarity":"陽","nayin":"炉中火","nayin_element":"火","label_ko":"병인(노중화)","label_zh":"丙寅(炉中火)","label_en":"Bing-Yin (Fire in the Furnace)"},
    {"index":4,"stem":"丁","branch":"卯","stem_index":4,"branch_index":4,"element":"火","polarity":"陰","nayin":"炉中火","nayin_element":"火","label_ko":"정묘(노중화)","label_zh":"丁卯(炉中火)","label_en":"Ding-Mao (Fire in the Furnace)"},
    {"index":5,"stem":"戊","branch":"辰","stem_index":5,"branch_index":5,"element":"土","polarity":"陽","nayin":"大林木","nayin_element":"木","label_ko":"무진(대림목)","label_zh":"戊辰(大林木)","label_en":"Wu-Chen (Great Forest Wood)"},
    {"index":6,"stem":"己","branch":"巳","stem_index":6,"branch_index":6,"element":"土","polarity":"陰","nayin":"大林木","nayin_element":"木","label_ko":"기사(대림목)","label_zh":"己巳(大林木)","label_en":"Ji-Si (Great Forest Wood)"},
    {"index":7,"stem":"庚","branch":"午","stem_index":7,"branch_index":7,"element":"金","polarity":"陽","nayin":"路旁土","nayin_element":"土","label_ko":"경오(노방토)","label_zh":"庚午(路旁土)","label_en":"Geng-Wu (Roadside Earth)"},
    {"index":8,"stem":"辛","branch":"未","stem_index":8,"branch_index":8,"element":"金","polarity":"陰","nayin":"路旁土","nayin_element":"土","label_ko":"신미(노방토)","label_zh":"辛未(路旁土)","label_en":"Xin-Wei (Roadside Earth)"},
    {"index":9,"stem":"壬","branch":"申","stem_index":9,"branch_index":9,"element":"水","polarity":"陽","nayin":"剑锋金","nayin_element":"金","label_ko":"임신(검봉금)","label_zh":"壬申(剑锋金)","label_en":"Ren-Shen (Sword Edge Metal)"},
    {"index":10,"stem":"癸","branch":"酉","stem_index":10,"branch_index":10,"element":"水","polarity":"陰","nayin":"剑锋金","nayin_element":"金","label_ko":"계유(검봉금)","label_zh":"癸酉(剑锋金)","label_en":"Gui-You (Sword Edge Metal)"},
    {"index":11,"stem":"甲","branch":"戌","stem_index":1,"branch_index":11,"element":"木","polarity":"陽","nayin":"山头火","nayin_element":"火","label_ko":"갑술(산두화)","label_zh":"甲戌(山头火)","label_en":"Jia-Xu (Mountain Peak Fire)"},
    {"index":12,"stem":"乙","branch":"亥","stem_index":2,"branch_index":12,"element":"木","polarity":"陰","nayin":"山头火","nayin_element":"火","label_ko":"을해(산두화)","label_zh":"乙亥(山头火)","label_en":"Yi-Hai (Mountain Peak Fire)"},
    {"index":13,"stem":"丙","branch":"子","stem_index":3,"branch_index":1,"element":"火","polarity":"陽","nayin":"涧下水","nayin_element":"水","label_ko":"병자(간하수)","label_zh":"丙子(涧下水)","label_en":"Bing-Zi (Stream Water in the Gorge)"},
    {"index":14,"stem":"丁","branch":"丑","stem_index":4,"branch_index":2,"element":"火","polarity":"陰","nayin":"涧下水","nayin_element":"水","label_ko":"정축(간하수)","label_zh":"丁丑(涧下水)","label_en":"Ding-Chou (Stream Water in the Gorge)"},
    {"index":15,"stem":"戊","branch":"寅","stem_index":5,"branch_index":3,"element":"土","polarity":"陽","nayin":"城头土","nayin_element":"土","label_ko":"무인(성두토)","label_zh":"戊寅(城头土)","label_en":"Wu-Yin (City Wall Earth)"},
    {"index":16,"stem":"己","branch":"卯","stem_index":6,"branch_index":4,"element":"土","polarity":"陰","nayin":"城头土","nayin_element":"土","label_ko":"기묘(성두토)","label_zh":"己卯(城头土)","label_en":"Ji-Mao (City Wall Earth)"},
    {"index":17,"stem":"庚","branch":"辰","stem_index":7,"branch_index":5,"element":"金","polarity":"陽","nayin":"白蜡金","nayin_element":"金","label_ko":"경진(백랍금)","label_zh":"庚辰(白蜡金)","label_en":"Geng-Chen (Wax Metal)"},
    {"index":18,"stem":"辛","branch":"巳","stem_index":8,"branch_index":6,"element":"金","polarity":"陰","nayin":"白蜡金","nayin_element":"金","label_ko":"신사(백랍금)","label_zh":"辛巳(白蜡金)","label_en":"Xin-Si (Wax Metal)"},
    {"index":19,"stem":"壬","branch":"午","stem_index":9,"branch_index":7,"element":"水","polarity":"陽","nayin":"杨柳木","nayin_element":"木","label_ko":"임오(양류목)","label_zh":"壬午(杨柳木)","label_en":"Ren-Wu (Willow Wood)"},
    {"index":20,"stem":"癸","branch":"未","stem_index":10,"branch_index":8,"element":"水","polarity":"陰","nayin":"杨柳木","nayin_element":"木","label_ko":"계미(양류목)","label_zh":"癸未(杨柳木)","label_en":"Gui-Wei (Willow Wood)"},
    {"index":21,"stem":"甲","branch":"申","stem_index":1,"branch_index":9,"element":"木","polarity":"陽","nayin":"泉中水","nayin_element":"水","label_ko":"갑신(천중수)","label_zh":"甲申(泉中水)","label_en":"Jia-Shen (Spring Water)"},
    {"index":22,"stem":"乙","branch":"酉","stem_index":2,"branch_index":10,"element":"木","polarity":"陰","nayin":"泉中水","nayin_element":"水","label_ko":"을유(천중수)","label_zh":"乙酉(泉中水)","label_en":"Yi-You (Spring Water)"},
    {"index":23,"stem":"丙","branch":"戌","stem_index":3,"branch_index":11,"element":"火","polarity":"陽","nayin":"屋上土","nayin_element":"土","label_ko":"병술(옥상토)","label_zh":"丙戌(屋上土)","label_en":"Bing-Xu (Rooftop Earth)"},
    {"index":24,"stem":"丁","branch":"亥","stem_index":4,"branch_index":12,"element":"火","polarity":"陰","nayin":"屋上土","nayin_element":"土","label_ko":"정해(옥상토)","label_zh":"丁亥(屋上土)","label_en":"Ding-Hai (Rooftop Earth)"},
    {"index":25,"stem":"戊","branch":"子","stem_index":5,"branch_index":1,"element":"土","polarity":"陽","nayin":"霹雳火","nayin_element":"火","label_ko":"무자(벽력화)","label_zh":"戊子(霹雳火)","label_en":"Wu-Zi (Thunderbolt Fire)"},
    {"index":26,"stem":"己","branch":"丑","stem_index":6,"branch_index":2,"element":"土","polarity":"陰","nayin":"霹雳火","nayin_element":"火","label_ko":"기축(벽력화)","label_zh":"己丑(霹雳火)","label_en":"Ji-Chou (Thunderbolt Fire)"},
    {"index":27,"stem":"庚","branch":"寅","stem_index":7,"branch_index":3,"element":"金","polarity":"陽","nayin":"松柏木","nayin_element":"木","label_ko":"경인(송백목)","label_zh":"庚寅(松柏木)","label_en":"Geng-Yin (Pine & Cypress Wood)"},
    {"index":28,"stem":"辛","branch":"卯","stem_index":8,"branch_index":4,"element":"金","polarity":"陰","nayin":"松柏木","nayin_element":"木","label_ko":"신묘(송백목)","label_zh":"辛卯(松柏木)","label_en":"Xin-Mao (Pine & Cypress Wood)"},
    {"index":29,"stem":"壬","branch":"辰","stem_index":9,"branch_index":5,"element":"水","polarity":"陽","nayin":"长流水","nayin_element":"水","label_ko":"임진(장류수)","label_zh":"壬辰(长流水)","label_en":"Ren-Chen (Long Flowing Water)"},
    {"index":30,"stem":"癸","branch":"巳","stem_index":10,"branch_index":6,"element":"水","polarity":"陰","nayin":"长流水","nayin_element":"水","label_ko":"계사(장류수)","label_zh":"癸巳(长流水)","label_en":"Gui-Si (Long Flowing Water)"},
    {"index":31,"stem":"甲","branch":"午","stem_index":1,"branch_index":7,"element":"木","polarity":"陽","nayin":"砂中金","nayin_element":"金","label_ko":"갑오(사중금)","label_zh":"甲午(砂中金)","label_en":"Jia-Wu (Metal in Sand)"},
    {"index":32,"stem":"乙","branch":"未","stem_index":2,"branch_index":8,"element":"木","polarity":"陰","nayin":"砂中金","nayin_element":"金","label_ko":"을미(사중금)","label_zh":"乙未(砂中金)","label_en":"Yi-Wei (Metal in Sand)"},
    {"index":33,"stem":"丙","branch":"申","stem_index":3,"branch_index":9,"element":"火","polarity":"陽","nayin":"山下火","nayin_element":"火","label_ko":"병신(산하화)","label_zh":"丙申(山下火)","label_en":"Bing-Shen (Fire at Mountain's Foot)"},
    {"index":34,"stem":"丁","branch":"酉","stem_index":4,"branch_index":10,"element":"火","polarity":"陰","nayin":"山下火","nayin_element":"火","label_ko":"정유(산하화)","label_zh":"丁酉(山下火)","label_en":"Ding-You (Fire at Mountain's Foot)"},
    {"index":35,"stem":"戊","branch":"戌","stem_index":5,"branch_index":11,"element":"土","polarity":"陽","nayin":"平地木","nayin_element":"木","label_ko":"무술(평지목)","label_zh":"戊戌(平地木)","label_en":"Wu-Xu (Flatland Wood)"},
    {"index":36,"stem":"己","branch":"亥","stem_index":6,"branch_index":12,"element":"土","polarity":"陰","nayin":"平地木","nayin_element":"木","label_ko":"기해(평지목)","label_zh":"己亥(平地木)","label_en":"Ji-Hai (Flatland Wood)"},
    {"index":37,"stem":"庚","branch":"子","stem_index":7,"branch_index":1,"element":"金","polarity":"陽","nayin":"壁上土","nayin_element":"土","label_ko":"경자(벽상토)","label_zh":"庚子(壁上土)","label_en":"Geng-Zi (Wall-Top Earth)"},
    {"index":38,"stem":"辛","branch":"丑","stem_index":8,"branch_index":2,"element":"金","polarity":"陰","nayin":"壁上土","nayin_element":"土","label_ko":"신축(벽상토)","label_zh":"辛丑(壁上土)","label_en":"Xin-Chou (Wall-Top Earth)"},
    {"index":39,"stem":"壬","branch":"寅","stem_index":9,"branch_index":3,"element":"水","polarity":"陽","nayin":"金箔金","nayin_element":"金","label_ko":"임인(금박금)","label_zh":"壬寅(金箔金)","label_en":"Ren-Yin (Gold Foil Metal)"},
    {"index":40,"stem":"癸","branch":"卯","stem_index":10,"branch_index":4,"element":"水","polarity":"陰","nayin":"金箔金","nayin_element":"金","label_ko":"계묘(금박금)","label_zh":"癸卯(金箔金)","label_en":"Gui-Mao (Gold Foil Metal)"},
    {"index":41,"stem":"甲","branch":"辰","stem_index":1,"branch_index":5,"element":"木","polarity":"陽","nayin":"覆灯火","nayin_element":"火","label_ko":"갑진(복등화)","label_zh":"甲辰(覆灯火)","label_en":"Jia-Chen (Covered Lamp Fire)"},
    {"index":42,"stem":"乙","branch":"巳","stem_index":2,"branch_index":6,"element":"木","polarity":"陰","nayin":"覆灯火","nayin_element":"火","label_ko":"을사(복등화)","label_zh":"乙巳(覆灯火)","label_en":"Yi-Si (Covered Lamp Fire)"},
    {"index":43,"stem":"丙","branch":"午","stem_index":3,"branch_index":7,"element":"火","polarity":"陽","nayin":"天河水","nayin_element":"水","label_ko":"병오(천하수)","label_zh":"丙午(天河水)","label_en":"Bing-Wu (Milky Way Water)"},